{"api_version":"forgeos.aadm.structural-replay-closure/v1","attestations":{"approval_authentication_attestation":false,"attempt_history_completeness_attestation":false,"authority_attestation":false,"authorization_attestation":false,"binding_authentication_attestation":false,"capsule_completeness_attestation":false,"cas_attestation":false,"completion_attestation":false,"content_provenance_attestation":false,"effect_attestation":false,"evaluation_execution_attestation":false,"evaluator_independence_attestation":false,"event_append_attestation":false,"execution_attestation":false,"external_history_resolution_attestation":false,"grant_authentication_attestation":false,"hard_guard_attestation":false,"instruction_attestation":false,"outcome_attestation":false,"permission_attestation":false,"persistence_attestation":false,"principal_authentication_attestation":false,"reflection_completeness_attestation":false,"replay_equivalence_attestation":false,"result_authentication_attestation":false,"rule_evaluation_attestation":false,"source_resolution_attestation":false,"transition_attestation":false,"truth_attestation":false,"usage_measurement_attestation":false,"verifier_independence_attestation":false,"world_state_resolution_attestation":false},"canonicalization":"forgeos.canonical-json/v1","closure_id":"structural-replay-closure-38f14574e9a9531371d55800f1f77bbdb79648a121c0f774a2a9c0083cf13497","closure_sha256":"38f14574e9a9531371d55800f1f77bbdb79648a121c0f774a2a9c0083cf13497","decision_capsule":{"api_version":"forgeos.aadm.decision-capsule/v1","attestations":{"approval_authentication_attestation":false,"attempt_history_completeness_attestation":false,"authority_attestation":false,"authorization_attestation":false,"binding_authentication_attestation":false,"capsule_completeness_attestation":false,"cas_attestation":false,"completion_attestation":false,"content_provenance_attestation":false,"effect_attestation":false,"evaluation_execution_attestation":false,"evaluator_independence_attestation":false,"event_append_attestation":false,"execution_attestation":false,"external_history_resolution_attestation":false,"grant_authentication_attestation":false,"hard_guard_attestation":false,"instruction_attestation":false,"outcome_attestation":false,"permission_attestation":false,"persistence_attestation":false,"principal_authentication_attestation":false,"reflection_completeness_attestation":false,"replay_equivalence_attestation":false,"result_authentication_attestation":false,"rule_evaluation_attestation":false,"source_resolution_attestation":false,"transition_attestation":false,"truth_attestation":false,"usage_measurement_attestation":false,"verifier_independence_attestation":false,"world_state_resolution_attestation":false},"canonicalization":"forgeos.canonical-json/v1","capsule_id":"decision-capsule-f02c172fb5d65a36841361a9969dd8ad79eae08c548d1c6d0bbea5a564276b59","capsule_mode":"structural_replay_manifest_only","capsule_sha256":"f02c172fb5d65a36841361a9969dd8ad79eae08c548d1c6d0bbea5a564276b59","decision_closure":{"api_version":"forgeos.kernel-decision-reference-closure/v1","attestations":{"approval_authentication_attestation":false,"authority_attestation":false,"authorization_attestation":false,"binding_authentication_attestation":false,"cas_attestation":false,"completion_attestation":false,"content_provenance_attestation":false,"effect_attestation":false,"event_append_attestation":false,"execution_attestation":false,"grant_authentication_attestation":false,"hard_guard_attestation":false,"instruction_attestation":false,"outcome_attestation":false,"permission_attestation":false,"persistence_attestation":false,"principal_authentication_attestation":false,"source_resolution_attestation":false,"transition_attestation":false,"truth_attestation":false,"usage_measurement_attestation":false,"verifier_independence_attestation":false},"canonicalization":"forgeos.canonical-json/v1","closure_id":"kernel-decision-reference-closure-cdadf0e5fddbbda429939be4e68dc77dd0b52c0bb7e4fe955f1d485183908e58","closure_sha256":"cdadf0e5fddbbda429939be4e68dc77dd0b52c0bb7e4fe955f1d485183908e58","cognitive_atoms":[{"api_version":"forgeos.aadm.cognitive-atom/v2","atom_id":"cognitive-atom-058a815ac035691ffe627935b86ef2964ac7d7ca87c9dc0a79cfbc61d0dc9aa5","atom_sha256":"058a815ac035691ffe627935b86ef2964ac7d7ca87c9dc0a79cfbc61d0dc9aa5","atom_type":"constraint","attestations":{"approval_authentication_attestation":false,"authority_attestation":false,"authorization_attestation":false,"binding_authentication_attestation":false,"cas_attestation":false,"completion_attestation":false,"content_provenance_attestation":false,"effect_attestation":false,"event_append_attestation":false,"execution_attestation":false,"grant_authentication_attestation":false,"hard_guard_attestation":false,"instruction_attestation":false,"outcome_attestation":false,"permission_attestation":false,"persistence_attestation":false,"principal_authentication_attestation":false,"source_resolution_attestation":false,"transition_attestation":false,"truth_attestation":false,"usage_measurement_attestation":false,"verifier_independence_attestation":false},"bindings":{"context_sha256":"1111111111111111111111111111111111111111111111111111111111111111","environment_profile_id":"fixture-environment-v1","environment_sha256":"2222222222222222222222222222222222222222222222222222222222222222","policy_sha256":"3333333333333333333333333333333333333333333333333333333333333333","source_profile_id":"fixture-source-v1","source_revision":"fixture-revision-0090","source_tree_sha256":"4444444444444444444444444444444444444444444444444444444444444444"},"canonicalization":"forgeos.canonical-json/v1","confidence_micros":null,"declared_authority":{"authority_kind":"contract_artifact","authority_ref":{"artifact_kind":"governance-contract","artifact_ref":"fixture/contract-v1","artifact_sha256":"3333333333333333333333333333333333333333333333333333333333333333"}},"declared_hardness":"contract","effective_hardness":"none","epistemic_state":"declared","instruction_allowed":false,"kind":"CognitiveAtom","proposition":{"object_type":"string","object_value":"value-03","predicate":"declares","subject":"fixture.atom.03"},"scope":{"module":"kernel-decision","object":"fixture.atom.03","project":"forgeos"},"source":{"source_kind":"work_intent","source_phase":"predecision","source_ref":{"work_intent_id":"work-intent-3333333333333333333333333333333333333333333333333333333333333333","work_intent_sha256":"3333333333333333333333333333333333333333333333333333333333333333"},"source_selector":"/intent/external_constraints/0"},"task_binding":{"attempt_id":null,"change_id":"change-kernel-decision-v1","environment_class":"development","environment_id":"fixture-development","node_id":"node-kernel-decision","project_id":"forgeos","role":"decision","run_id":"run-kernel-decision-fixture","target_id":null,"task_id":"task-kernel-decision-v1"},"validity":{"valid_from_unix_ms":1700000000000,"valid_until_unix_ms":null}},{"api_version":"forgeos.aadm.cognitive-atom/v2","atom_id":"cognitive-atom-13aef427d5f72c5d24cb82257d2fe64160dde55d35027b1339996853f9507a4a","atom_sha256":"13aef427d5f72c5d24cb82257d2fe64160dde55d35027b1339996853f9507a4a","atom_type":"inference","attestations":{"approval_authentication_attestation":false,"authority_attestation":false,"authorization_attestation":false,"binding_authentication_attestation":false,"cas_attestation":false,"completion_attestation":false,"content_provenance_attestation":false,"effect_attestation":false,"event_append_attestation":false,"execution_attestation":false,"grant_authentication_attestation":false,"hard_guard_attestation":false,"instruction_attestation":false,"outcome_attestation":false,"permission_attestation":false,"persistence_attestation":false,"principal_authentication_attestation":false,"source_resolution_attestation":false,"transition_attestation":false,"truth_attestation":false,"usage_measurement_attestation":false,"verifier_independence_attestation":false},"bindings":{"context_sha256":"1111111111111111111111111111111111111111111111111111111111111111","environment_profile_id":"fixture-environment-v1","environment_sha256":"2222222222222222222222222222222222222222222222222222222222222222","policy_sha256":"3333333333333333333333333333333333333333333333333333333333333333","source_profile_id":"fixture-source-v1","source_revision":"fixture-revision-0090","source_tree_sha256":"4444444444444444444444444444444444444444444444444444444444444444"},"canonicalization":"forgeos.canonical-json/v1","confidence_micros":400010,"declared_authority":{"authority_kind":"none","authority_ref":null},"declared_hardness":"none","effective_hardness":"none","epistemic_state":"candidate","instruction_allowed":false,"kind":"CognitiveAtom","proposition":{"object_type":"string","object_value":"value-10","predicate":"declares","subject":"fixture.atom.10"},"scope":{"module":"kernel-decision","object":"fixture.atom.10","project":"forgeos"},"source":{"source_kind":"cognitive_atom_v1","source_phase":"predecision","source_ref":{"atom_id":"atom-aaaaaaaaaaaaaaaaaaaaaaaaaaaaaaaaaaaaaaaaaaaaaaaaaaaaaaaaaaaaaaaa","canonical_sha256":"ffffffffffffffffffffffffffffffffffffffffffffffffffffffffffffffff"},"source_selector":null},"task_binding":{"attempt_id":null,"change_id":"change-kernel-decision-v1","environment_class":"development","environment_id":"fixture-development","node_id":"node-kernel-decision","project_id":"forgeos","role":"decision","run_id":"run-kernel-decision-fixture","target_id":null,"task_id":"task-kernel-decision-v1"},"validity":{"valid_from_unix_ms":1700000000000,"valid_until_unix_ms":null}},{"api_version":"forgeos.aadm.cognitive-atom/v2","atom_id":"cognitive-atom-179221c8a4ece8dd2c431a5dbc42beac132ed19278c4473fa4328b1d90e2dfff","atom_sha256":"179221c8a4ece8dd2c431a5dbc42beac132ed19278c4473fa4328b1d90e2dfff","atom_type":"risk","attestations":{"approval_authentication_attestation":false,"authority_attestation":false,"authorization_attestati